### ISSUE TITLE
Errorcode 453: SessionID destroyed on Triax Tss 400

### ISSUE THREAD

**Issue by ka-vaNu** [rofafor/vdr-plugin-satip#34]
There ist a SessionID transmitted from the TSS400 to my vdr-box (Session:35d6ea6d11692b;). But there is no space left between "Session:" and the sessionId. The sessionId is used later on but the first character of the sessionId is lost.

Getting sessionId
22:02:37.598248 IP bpi.fritz.box.48391 > TSS400-MKII.fritz.box.rtsp: Flags [P.], seq 91:358, ack 73, win 115, options [nop,nop,TS val 77521957 ecr 807105], length 267
        0x0000:  4500 013f 4a47 4000 4006 69e6 c0a8 021c  E..?JG@.@.i.....
        0x0010:  c0a8 021f bd07 022a 99a5 aec1 1938 73dd  .......*.....8s.
        0x0020:  8018 0073 86bd 0000 0101 080a 049e e425  ...s...........%
        0x0030:  000c 50c1 5345 5455 5020 7274 7370 3a2f  ..P.SETUP.rtsp:/
        0x0040:  2f31 3932 2e31 3638 2e32 2e33 312f 3f73  /192.168.2.31/?s
        0x0050:  7263 3d31 2666 7265 713d 3130 3734 3326  rc=1&freq=10743&
        0x0060:  706f 6c3d 6826 726f 3d30 2e33 3526 6d73  pol=h&ro=0.35&ms
        0x0070:  7973 3d64 7662 7326 6d74 7970 653d 7170  ys=dvbs&mtype=qp
        0x0080:  736b 2670 6c74 733d 6f66 6626 7372 3d32  sk&plts=off&sr=2
        0x0090:  3230 3030 2666 6563 3d35 3620 5254 5350  2000&fec=56.RTSP
        0x00a0:  2f31 2e30 0d0a 4353 6571 3a20 320d 0a54  /1.0..CSeq:.2..T
        0x00b0:  7261 6e73 706f 7274 3a20 5254 502f 4156  ransport:.RTP/AV
        0x00c0:  503b 756e 6963 6173 743b 636c 6965 6e74  P;unicast;client
        0x00d0:  5f70 6f72 743d 3538 3630 302d 3538 3630  _port=58600-5860
        0x00e0:  310d 0a55 7365 722d 4167 656e 743a 2076  1..User-Agent:.v
        0x00f0:  6472 2d73 6174 6970 2f32 2e32 2e34 2028  dr-satip/2.2.4.(
        0x0100:  6465 7669 6365 2030 290d 0a49 662d 4d6f  device.0)..If-Mo
        0x0110:  6469 6669 6564 2d53 696e 6365 3a20 5468  dified-Since:.Th
        0x0120:  752c 2030 3120 4a61 6e20 3139 3730 2030  u,.01.Jan.1970.0
        0x0130:  303a 3030 3a30 3020 474d 540d 0a0d 0a    0:00:00.GMT....
22:02:37.638902 IP TSS400-MKII.fritz.box.rtsp > bpi.fritz.box.48391: Flags [.], ack 358, win 243, options [nop,nop,TS val 807116 ecr 77521957], length 0
        0x0000:  4500 0034 2356 4000 4006 91e2 c0a8 021f  E..4#V@.@.......
        0x0010:  c0a8 021c 022a bd07 1938 73dd 99a5 afcc  .....*...8s.....
        0x0020:  8010 00f3 20e9 0000 0101 080a 000c 50cc  ..............P.
        0x0030:  049e e425                                ...%
22:02:37.710663 IP TSS400-MKII.fritz.box.rtsp > bpi.fritz.box.48391: Flags [P.], seq 73:234, ack 358, win 243, options [nop,nop,TS val 807133 ecr 77521957], length 161
        0x0000:  4500 00d5 2357 4000 4006 9140 c0a8 021f  E...#W@.@..@....
        0x0010:  c0a8 021c 022a bd07 1938 73dd 99a5 afcc  .....*...8s.....
        0x0020:  8018 00f3 e686 0000 0101 080a 000c 50dd  ..............P.
        0x0030:  049e e425 5254 5350 2f31 2e30 2032 3030  ...%RTSP/1.0.200
        0x0040:  204f 4b0d 0a53 6573 7369 6f6e 3a33 3564  .OK..Session:35d
        0x0050:  3665 6136 6431 3136 3932 623b 7469 6d65  6ea6d11692b;time
        0x0060:  6f75 743d 3330 0d0a 636f 6d2e 7365 732e  out=30..com.ses.
        0x0070:  7374 7265 616d 4944 3a33 3038 330d 0a54  streamID:3083..T
        0x0080:  7261 6e73 706f 7274 3a52 5450 2f41 5650  ransport:RTP/AVP
        0x0090:  3b75 6e69 6361 7374 3b64 6573 7469 6e61  ;unicast;destina
        0x00a0:  7469 6f6e 3d31 3932 2e31 3638 2e32 2e32  tion=192.168.2.2
        0x00b0:  383b 636c 6965 6e74 5f70 6f72 743d 3538  8;client_port=58
        0x00c0:  3630 302d 3538 3630 310d 0a43 5365 713a  600-58601..CSeq:
        0x00d0:  320d 0a0d 0a                             2....

Reuse of sessionId without first character
22:02:37.711428 IP bpi.fritz.box.48391 > TSS400-MKII.fritz.box.rtsp: Flags [P.], seq 358:559, ack 234, win 123, options [nop,nop,TS val 77521969 ecr 807133], length 201
        0x0000:  4500 00fd 4a48 4000 4006 6a27 c0a8 021c  E...JH@.@.j'....
        0x0010:  c0a8 021f bd07 022a 99a5 afcc 1938 747e  .......*.....8t~
        0x0020:  8018 007b 867b 0000 0101 080a 049e e431  ...{.{.........1
        0x0030:  000c 50dd 4445 5343 5249 4245 2072 7473  ..P.DESCRIBE.rts
        0x0040:  703a 2f2f 3139 322e 3136 382e 322e 3331  p://192.168.2.31
        0x0050:  2f73 7472 6561 6d3d 3330 3833 2052 5453  /stream=3083.RTS
        0x0060:  502f 312e 300d 0a43 5365 713a 2033 0d0a  P/1.0..CSeq:.3..
        0x0070:  5365 7373 696f 6e3a 2035 6436 6561 3664  Session:.5d6ea6d
        0x0080:  3131 3639 3262 0d0a 4163 6365 7074 3a20  11692b..Accept:.
        0x0090:  6170 706c 6963 6174 696f 6e2f 7364 700d  application/sdp.
        0x00a0:  0a55 7365 722d 4167 656e 743a 2076 6472  .User-Agent:.vdr
        0x00b0:  2d73 6174 6970 2f32 2e32 2e34 2028 6465  -satip/2.2.4.(de
        0x00c0:  7669 6365 2030 290d 0a49 662d 4d6f 6469  vice.0)..If-Modi
        0x00d0:  6669 6564 2d53 696e 6365 3a20 5468 752c  fied-Since:.Thu,
        0x00e0:  2030 3120 4a61 6e20 3139 3730 2030 303a  .01.Jan.1970.00:
        0x00f0:  3030 3a30 3020 474d 540d 0a0d 0a         00:00.GMT....
22:02:37.712356 IP TSS400-MKII.fritz.box.rtsp > bpi.fritz.box.48391: Flags [.], ack 559, win 260, options [nop,nop,TS val 807134 ecr 77521969], length 0
        0x0000:  4500 0034 2358 4000 4006 91e0 c0a8 021f  E..4#X@.@.......
        0x0010:  c0a8 021c 022a bd07 1938 747e 99a5 b095  .....*...8t~....
        0x0020:  8010 0104 1f50 0000 0101 080a 000c 50de  .....P........P.
        0x0030:  049e e431                                ...1
22:02:37.717798 IP TSS400-MKII.fritz.box.rtsp > bpi.fritz.box.48391: Flags [P.], seq 234:318, ack 559, win 260, options [nop,nop,TS val 807135 ecr 77521969], length 84
        0x0000:  4500 0088 2359 4000 4006 918b c0a8 021f  E...#Y@.@.......
        0x0010:  c0a8 021c 022a bd07 1938 747e 99a5 b095  .....*...8t~....
        0x0020:  8018 0104 3d95 0000 0101 080a 000c 50df  ....=.........P.
        0x0030:  049e e431 5254 5350 2f31 2e30 2034 3534  ...1RTSP/1.0.454
        0x0040:  2053 6573 7369 6f6e 204e 6f74 2046 6f75  .Session.Not.Fou
        0x0050:  6e64 0d0a 4353 6571 3a33 0d0a 5365 7373  nd..CSeq:3..Sess
        0x0060:  696f 6e3a 3564 3665 6136 6431 3136 3932  ion:5d6ea6d11692
        0x0070:  620d 0a43 6f6e 7465 6e74 2d4c 656e 6774  b..Content-Lengt
        0x0080:  683a 2030 0d0a 0d0a                      h:.0....

**Comment by ka-vaNu** [comment]
btw:
raspbian on bananapi with  
- vdr-2.2.0 
- curl 7.52.1 (armv7l-unknown-linux-gnueabihf) libcurl/7.26.0 OpenSSL/1.0.1t zlib/1.2.7 libidn/1.25 libssh2/1.4.2 librtmp/2.3
Protocols: dict file ftp ftps gopher http https imap imaps ldap pop3 pop3s rtmp rtsp scp sftp smtp smtps telnet tftp
Features: Debug IDN IPv6 Largefile NTLM NTLM_WB SSL libz TLS-SRP
- satip-2.2.4
- libtinyxml-dev                        2.6.2-1

**Comment by ka-vaNu** [comment]
btw:
raspbian on bananapi with

    vdr-2.2.0
    curl 7.52.1 (armv7l-unknown-linux-gnueabihf) libcurl/7.26.0 OpenSSL/1.0.1t zlib/1.2.7 libidn/1.25 libssh2/1.4.2 librtmp/2.3
    Protocols: dict file ftp ftps gopher http https imap imaps ldap pop3 pop3s rtmp rtsp scp sftp smtp smtps telnet tftp
    Features: Debug IDN IPv6 Largefile NTLM NTLM_WB SSL libz TLS-SRP
    satip-2.2.4
    libtinyxml-dev 2.6.2-1

**Comment by ka-vaNu** [comment]
aargh, there was also an old version of curl installed. It works perfect with >= 7.36.0
